{
  "vocabulary_version": "0.1.0",
  "vocabulary_serial": 1,
  "next_id": 1156,
  "terms": {
    "kick.hit": {
      "id": 1001,
      "display_name": "Kick",
      "status": "active",
      "added_in": "0.1.0",
      "axes": {
        "instrument": "kick",
        "technique": "hit"
      },
      "role_hint": "foundation"
    },
    "kick.hit.damped": {
      "id": 1002,
      "display_name": "Kick, damped",
      "status": "active",
      "added_in": "0.1.0",
      "axes": {
        "instrument": "kick",
        "technique": "hit",
        "mechanism": "kick-damped"
      },
      "parent": "kick.hit",
      "role_hint": "foundation"
    },
    "kick.hit.half-open": {
      "id": 1003,
      "display_name": "Kick, half open",
      "status": "active",
      "added_in": "0.1.0",
      "axes": {
        "instrument": "kick",
        "technique": "hit",
        "mechanism": "kick-half-open"
      },
      "parent": "kick.hit",
      "role_hint": "foundation"
    },
    "kick.hit.wires-off": {
      "id": 1004,
      "display_name": "Kick, snares off",
      "status": "active",
      "added_in": "0.1.0",
      "axes": {
        "instrument": "kick",
        "technique": "hit",
        "mechanism": "wires-off"
      },
      "parent": "kick.hit",
      "role_hint": "foundation"
    },
    "kick.hit.felt": {
      "id": 1005,
      "display_name": "Kick, felt beater",
      "status": "active",
      "added_in": "0.1.0",
      "axes": {
        "instrument": "kick",
        "technique": "hit",
        "implement": "felt-beater"
      },
      "parent": "kick.hit",
      "role_hint": "foundation"
    },
    "kick.hit.wood": {
      "id": 1006,
      "display_name": "Kick, wood beater",
      "status": "active",
      "added_in": "0.1.0",
      "axes": {
        "instrument": "kick",
        "technique": "hit",
        "implement": "wood-beater"
      },
      "parent": "kick.hit",
      "role_hint": "foundation"
    },
    "kick.hit.plastic": {
      "id": 1007,
      "display_name": "Kick, plastic beater",
      "status": "active",
      "added_in": "0.1.0",
      "axes": {
        "instrument": "kick",
        "technique": "hit",
        "implement": "plastic-beater"
      },
      "parent": "kick.hit",
      "role_hint": "foundation"
    },
    "kick.hit.double": {
      "id": 1008,
      "display_name": "Kick, auto double",
      "status": "active",
      "added_in": "0.1.0",
      "axes": {
        "instrument": "kick",
        "technique": "hit",
        "ornament": "bounced"
      },
      "parent": "kick.hit",
      "role_hint": "foundation"
    },
    "kick.rim": {
      "id": 1009,
      "display_name": "Kick rim",
      "status": "active",
      "added_in": "0.1.0",
      "axes": {
        "instrument": "kick",
        "site": "rim",
        "technique": "hit"
      },
      "parent": "kick.hit",
      "role_hint": "effect"
    },
    "kick.electric": {
      "id": 1010,
      "display_name": "Kick, electronic",
      "status": "active",
      "added_in": "0.1.0",
      "axes": {
        "instrument": "kick",
        "technique": "hit",
        "timbre": "electronic"
      },
      "parent": "kick.hit",
      "role_hint": "foundation"
    },
    "snare.hit": {
      "id": 1011,
      "display_name": "Snare",
      "status": "active",
      "added_in": "0.1.0",
      "axes": {
        "instrument": "snare",
        "site": "head",
        "position": "centre",
        "technique": "hit"
      },
      "role_hint": "backbeat"
    },
    "snare.hit.halfway": {
      "id": 1012,
      "display_name": "Snare, halfway",
      "status": "active",
      "added_in": "0.1.0",
      "axes": {
        "instrument": "snare",
        "site": "head",
        "position": "halfway",
        "technique": "hit"
      },
      "parent": "snare.hit",
      "role_hint": "backbeat"
    },
    "snare.hit.offset": {
      "id": 1013,
      "display_name": "Snare, off centre",
      "status": "active",
      "added_in": "0.1.0",
      "axes": {
        "instrument": "snare",
        "site": "head",
        "position": "offset",
        "technique": "hit"
      },
      "parent": "snare.hit",
      "role_hint": "backbeat"
    },
    "snare.hit.edge": {
      "id": 1014,
      "display_name": "Snare, edge",
      "status": "active",
      "added_in": "0.1.0",
      "axes": {
        "instrument": "snare",
        "site": "head",
        "position": "perimeter",
        "technique": "hit"
      },
      "parent": "snare.hit",
      "role_hint": "backbeat"
    },
    "snare.hit.ghost": {
      "id": 1015,
      "display_name": "Snare, ghost",
      "status": "active",
      "added_in": "0.1.0",
      "axes": {
        "instrument": "snare",
        "site": "head",
        "technique": "hit",
        "dynamic": "ghost"
      },
      "parent": "snare.hit",
      "role_hint": "ghost"
    },
    "snare.hit.soft": {
      "id": 1016,
      "display_name": "Snare, soft layer",
      "status": "active",
      "added_in": "0.1.0",
      "axes": {
        "instrument": "snare",
        "site": "head",
        "technique": "hit",
        "dynamic": "soft"
      },
      "parent": "snare.hit",
      "role_hint": "backbeat"
    },
    "snare.hit.hard": {
      "id": 1017,
      "display_name": "Snare, hard layer",
      "status": "active",
      "added_in": "0.1.0",
      "axes": {
        "instrument": "snare",
        "site": "head",
        "technique": "hit",
        "dynamic": "hard"
      },
      "parent": "snare.hit",
      "role_hint": "backbeat"
    },
    "snare.rimshot": {
      "id": 1018,
      "display_name": "Snare rimshot",
      "status": "active",
      "added_in": "0.1.0",
      "axes": {
        "instrument": "snare",
        "site": "rim",
        "technique": "rimshot"
      },
      "parent": "snare.hit",
      "role_hint": "backbeat"
    },
    "snare.rimshot.shallow": {
      "id": 1019,
      "display_name": "Snare rimshot, shallow",
      "status": "active",
      "added_in": "0.1.0",
      "axes": {
        "instrument": "snare",
        "site": "rim",
        "position": "perimeter",
        "technique": "rimshot"
      },
      "parent": "snare.rimshot",
      "role_hint": "backbeat"
    },
    "snare.rim-only": {
      "id": 1020,
      "display_name": "Snare rim only",
      "status": "active",
      "added_in": "0.1.0",
      "axes": {
        "instrument": "snare",
        "site": "rim",
        "technique": "rim-only"
      },
      "parent": "snare.hit",
      "role_hint": "ghost"
    },
    "snare.sidestick": {
      "id": 1021,
      "display_name": "Snare cross stick",
      "status": "active",
      "added_in": "0.1.0",
      "axes": {
        "instrument": "snare",
        "site": "crossstick",
        "technique": "sidestick"
      },
      "parent": "snare.hit",
      "role_hint": "ghost"
    },
    "snare.stick-shot": {
      "id": 1022,
      "display_name": "Snare stick shot",
      "status": "active",
      "added_in": "0.1.0",
      "axes": {
        "instrument": "snare",
        "site": "head",
        "technique": "stick-shot"
      },
      "parent": "snare.hit",
      "role_hint": "accent"
    },
    "snare.back-stick": {
      "id": 1023,
      "display_name": "Snare back stick",
      "status": "active",
      "added_in": "0.1.0",
      "axes": {
        "instrument": "snare",
        "site": "head",
        "technique": "back-stick"
      },
      "parent": "snare.hit",
      "role_hint": "accent"
    },
    "snare.ping-shot": {
      "id": 1024,
      "display_name": "Snare ping shot",
      "status": "active",
      "added_in": "0.1.0",
      "axes": {
        "instrument": "snare",
        "site": "rim",
        "technique": "ping-shot"
      },
      "parent": "snare.rimshot",
      "role_hint": "accent"
    },
    "snare.gok-shot": {
      "id": 1025,
      "display_name": "Snare gok shot",
      "status": "active",
      "added_in": "0.1.0",
      "axes": {
        "instrument": "snare",
        "site": "rim",
        "technique": "gok-shot"
      },
      "parent": "snare.rimshot",
      "role_hint": "accent"
    },
    "snare.shell": {
      "id": 1026,
      "display_name": "Snare shell",
      "status": "active",
      "added_in": "0.1.0",
      "axes": {
        "instrument": "snare",
        "site": "shell",
        "technique": "hit"
      },
      "parent": "snare.hit",
      "role_hint": "effect"
    },
    "snare.flam": {
      "id": 1027,
      "display_name": "Snare flam",
      "status": "active",
      "added_in": "0.1.0",
      "axes": {
        "instrument": "snare",
        "site": "head",
        "technique": "hit",
        "ornament": "flam"
      },
      "parent": "snare.hit",
      "role_hint": "backbeat"
    },
    "snare.drag": {
      "id": 1028,
      "display_name": "Snare drag",
      "status": "active",
      "added_in": "0.1.0",
      "axes": {
        "instrument": "snare",
        "site": "head",
        "technique": "hit",
        "ornament": "drag"
      },
      "parent": "snare.hit",
      "role_hint": "backbeat"
    },
    "snare.ruff": {
      "id": 1029,
      "display_name": "Snare ruff",
      "status": "active",
      "added_in": "0.1.0",
      "axes": {
        "instrument": "snare",
        "site": "head",
        "technique": "hit",
        "ornament": "ruff"
      },
      "parent": "snare.hit",
      "role_hint": "backbeat"
    },
    "snare.roll": {
      "id": 1030,
      "display_name": "Snare roll",
      "status": "active",
      "added_in": "0.1.0",
      "axes": {
        "instrument": "snare",
        "site": "head",
        "technique": "hit",
        "ornament": "roll"
      },
      "parent": "snare.hit",
      "role_hint": "fill"
    },
    "snare.buzz": {
      "id": 1031,
      "display_name": "Snare buzz roll",
      "status": "active",
      "added_in": "0.1.0",
      "axes": {
        "instrument": "snare",
        "site": "head",
        "technique": "hit",
        "ornament": "buzz"
      },